{
  "slug": "nim-agency-dev",
  "title": "NIM Agency Development",
  "description": "The agency itself: dogfood project tracking the open threads from MANIFEST KNOWN GAPS. Steered by editing this project between cycles.",
  "status_id": 2,
  "priority": 3,
  "crue_id": null,
  "engagements": [
    {
      "agent_id": "739e1316-3ea6-41d9-ae36-6b53d4b48707",
      "role": "lead",
      "responsibilities": [
        "own the projects subsystem"
      ],
      "status_id": 7,
      "assigned_at": "2026-09-01T02:07:55.941153+00:00",
      "released_at": null
    }
  ],
  "host_binding": {
    "substation_id": null,
    "worktrees": [
      {
        "path": "/Users/bradley/Developer/nim/nim.agency",
        "writable": false,
        "primary": true
      }
    ],
    "required_permissions": [
      "read"
    ]
  },
  "objectives": [
    {
      "id": 1,
      "text": "Stand up a test suite (no tests exist today)",
      "done": false
    },
    {
      "id": 2,
      "text": "Declare dependencies: core is stdlib; asyncssh, cryptography, jsonschema optional",
      "done": false
    },
    {
      "id": 3,
      "text": "Split the tui/builder.py monolith (~4900 lines)",
      "done": false
    },
    {
      "id": 4,
      "text": "Build key distribution and revocation flows (vault issuance only today)",
      "done": false
    },
    {
      "id": 5,
      "text": "Feed mission outcomes into achievements (economy is wired, achievements are not)",
      "done": false
    },
    {
      "id": 6,
      "text": "Add a TUI reattach view for backgrounded dispatch runs",
      "done": false
    },
    {
      "id": 7,
      "text": "Live-test lib/remote against real infrastructure",
      "done": false
    },
    {
      "id": 8,
      "text": "Make mission show -v render dispatch-time prompts, not recomposed state",
      "done": false
    },
    {
      "id": 9,
      "text": "Rename one of the twin ops_log.py modules (dispatch lifecycle vs HQ remote-ops)",
      "done": false
    }
  ],
  "specifications": [
    {
      "label": "bootstrap",
      "path_or_url": ".nim/instructions/nim.agency.projects.bootstrap.md"
    },
    {
      "label": "manifest",
      "path_or_url": "MANIFEST.md"
    }
  ],
  "directives": [
    "Keep every state-changing command observable - explicit ceremonies over silent side effects",
    "Keep the briefing gate in front of anything that spawns agent work"
  ],
  "artifacts": [],
  "policy": {
    "max_cycles": null,
    "read_only": true,
    "max_concurrent_engagements": 1
  },
  "journal": [
    {
      "cycle": 1,
      "mission_id": "e61a4188",
      "at": "2026-09-01T15:29:59.407557+00:00",
      "status": "complete",
      "note": "1/1 tasks complete"
    }
  ],
  "owl_id": null,
  "created_by": "operator",
  "id": "ce5bb035-6b23-4916-86f9-60c9002df4d2",
  "audit": {
    "created_at": "2026-09-01T01:46:08.079433+00:00",
    "updated_at": "2026-09-01T15:29:59.407606+00:00",
    "retired_at": null
  }
}